commit_hash	metric	status	description	timestamp
c7797b80331bbaa4a53394e5353b82dd15da650e	1.0	keep	Add comprehensive test cases for - Improved metric from 0.0000 to 1.0000	2026-03-22T21:41:29.846707
142e84f52f299aa03bc5924a7fc2a04659ab4b3c	1.0	discard	Add unit tests for neglected modules (glue, __init__) - No improvement: 1.0000 -> 1.0000	2026-03-22T21:43:21.487551
f887a046b1e5b191b96c4cefe65c6018041d4552	9.0	keep	<AST-based auto-generation> - Improved metric from 3.0000 to 9.0000	2026-03-22T21:44:04.690610
6c6edfba125613385d4b7e8222582d3b1cf29e2b	14.0	keep	Use AST introspection to generate - Improved metric from 9.0000 to 14.0000	2026-03-22T21:44:39.755429
b63fbaeabe340ed78d449970388be71d005735c9	1.0	discard	<Fix incomplete AST logic to enable test execution> - No improvement: 1.0000 -> 1.0000	2026-03-22T21:44:58.711960
6a0ff4fab763f3e39b77e2ff4cabe26cd0566980	12.0	discard	Fix syntax errors in generate_tests.py and implement complete test generation logic (instantiate classes) to boost baseline coverage. - No improvement: 14.0000 -> 12.0000	2026-03-22T21:45:41.572154
4a659b1870322e4a18ce539d5d67381cac6789ad	11.0	discard	Fix syntax errors in generate_test - No improvement: 12.0000 -> 11.0000	2026-03-22T21:46:11.677209
ad03857becc870ede85fd3905e6e0f0521e42d90	11.0	discard	Fix critical IndentationError and SyntaxError in generate_tests.py to enable AST parsing and test generation. - No improvement: 11.0000 -> 11.0000	2026-03-22T21:46:37.931880
dd20a306ec644566d959cd7621ed8884f9ef3927	11.0	discard	Fix syntax errors in generate_tests.py to enable test generation. - No improvement: 11.0000 -> 11.0000	2026-03-22T21:46:52.678754
f4092c0735aafdaa50a549456906b776b9d9f44e	11.0	discard	Fix IndentationError in generate_tests.py to restore test generation pipeline. - No improvement: 11.0000 -> 11.0000	2026-03-22T21:47:00.787205
21df2334411cdb698912f398e984177bdeaaadf2	1.0	keep	The `generate_tests.py` script is syntactically broken - Improved metric from 11.0000 to 1.0000	2026-03-22T21:47:30.938833
21df2334411cdb698912f398e984177bdeaaadf2	0.0	crash	Fix the syntax errors in `generate_tests.py` (specifically the - Experiment failed: Could not extract metric from output: Generated test file at: /home/jericho/zion/projects/ouroboros/ouroboros/tests/test_generated.py
...	2026-03-22T21:47:59.238949
095d01fa059ac49caff03c3001b4bcd6031de9e2	0.0	discard	Run the test generator to create a baseline test suite for all - No improvement: 0.0000 -> 0.0000	2026-03-22T21:48:52.090876
